{
  "id": "MOD-001-FEAT-001-STORY-001",
  "title": "User can view their profile information",
  "description": "As a logged-in user, I want to view my profile information, so that I can verify my account details are correct.",
  "featureId": "MOD-001-FEAT-001",
  "status": "backlog",
  "acceptanceCriteria": [
    {
      "criterion": "Given I am logged in, when I navigate to the profile page, then I see my username, email, and registration date",
      "verified": false
    },
    {
      "criterion": "Given I am on the profile page, when the page loads, then all information is displayed within 2 seconds",
      "verified": false
    }
  ],
  "definitionOfDone": [
    {
      "item": "All acceptance criteria verified",
      "completed": false
    },
    {
      "item": "Unit tests written and passing (>80% coverage)",
      "completed": false
    },
    {
      "item": "Integration tests passing",
      "completed": false
    },
    {
      "item": "E2E tests passing (if UI changes)",
      "completed": false
    },
    {
      "item": "Code reviewed by human",
      "completed": false
    },
    {
      "item": "Security scan passed",
      "completed": false
    },
    {
      "item": "Performance benchmarks met",
      "completed": false
    },
    {
      "item": "Documentation updated",
      "completed": false
    },
    {
      "item": "Deployed to staging",
      "completed": false
    }
  ],
  "definitionOfReady": [
    {
      "item": "User story is clearly defined",
      "ready": true
    },
    {
      "item": "Acceptance criteria are documented",
      "ready": true
    },
    {
      "item": "Dependencies are identified",
      "ready": true
    },
    {
      "item": "Story is estimated",
      "ready": false
    }
  ],
  "assignee": "",
  "storyPoints": 0,
  "priority": "medium",
  "testing": {
    "unit": {
      "required": true,
      "coverage": 80,
      "status": "not-started"
    },
    "integration": {
      "required": true,
      "status": "not-started"
    },
    "e2e": {
      "required": false,
      "status": "not-started"
    },
    "performance": {
      "required": false,
      "benchmarks": []
    }
  },
  "metadata": {
    "createdAt": "2025-01-01T00:00:00Z",
    "updatedAt": "2025-01-01T00:00:00Z",
    "createdBy": "system",
    "tags": ["example"]
  }
}
